{
  "schema": 1,
  "name": "vmasrani/wikipedia-multi-5gb",
  "title": "wikipedia-multi-5gb",
  "version": "0",
  "publisher": "Parot Research",
  "license": "CC-BY-SA-4.0",
  "source_url": "https://dumps.wikimedia.org/",
  "warranty": true,
  "description": "",
  "size_bytes": 1866399688,
  "sha256": "94cfe694d5f1a83369662f0041f0ece89afd1f079d7a50179d34c39a7f78f2a7",
  "filename": "wikipedia-multi-5gb.cart",
  "urls": [
    "https://github.com/vmasrani/cartridges/releases/download/wikipedia-multi-5gb-v2/wikipedia-multi-5gb.cart"
  ],
  "card": {
    "$schema": "https://parot.app/schemas/card/1.0.json",
    "access": {
      "encrypted": false,
      "integrity": {
        "per_region_crc32": true,
        "whole_file_crc32": true
      },
      "license_key_required": false
    },
    "card_version": "1.0",
    "citation": {
      "column": null,
      "example": null,
      "format": null,
      "monotone": false,
      "stable": false
    },
    "fidelity": {
      "binaries": {
        "indexed": false,
        "skipped": 0
      },
      "case_insensitive": false,
      "case_preserved": false,
      "dedup": {
        "mode": "none",
        "removed": 0
      },
      "encoding": {
        "line_endings": "lf",
        "non_utf8_bytes": 0,
        "utf8": true
      },
      "normalize_whitespace": false,
      "parse_error_policy": "fail",
      "skipped": {
        "excluded_by_glob": 0,
        "parse_errors": 0,
        "symlinks": 0
      },
      "store_source": false,
      "verified": {
        "round_trip": null
      }
    },
    "identity": {
      "category": "other",
      "description": "",
      "homepage": null,
      "id": "sha256:6f890669e87c064a58360ccda445e3890a8ac8e5e8d1faf359005999bd8c5bb9",
      "license": {
        "spdx": null,
        "url": null
      },
      "name": "wikipedia-multi-5gb",
      "publisher": "Parot Research",
      "source_license": {
        "spdx": null,
        "url": null
      },
      "supersedes": null,
      "tags": [],
      "title": "wikipedia-multi-5gb",
      "version": "0"
    },
    "index": {
      "compression_effort": null,
      "doc_index": false,
      "doc_index_mode": "none",
      "filter": "minimizer-multi",
      "locate_level": 2,
      "max_shard_bytes": 18672811,
      "shard_size": "auto",
      "shards": 73
    },
    "provenance": {
      "builder": {
        "format": 4,
        "tool": "cartridge",
        "version": "0.16.9"
      },
      "duration_s": 437,
      "environment": {
        "arch": "aarch64",
        "os": "macos"
      },
      "finished_at": "2026-10-02T21:23:11Z",
      "invocation": {
        "argv": [
          "cartpress",
          "press",
          "wikipedia-multi-5gb.csv",
          "--index-largest"
        ],
        "cwd": "/Volumes/external/dev/datasets"
      },
      "recipe": null,
      "source": {
        "bytes": 4999921197,
        "description": null,
        "files": 1,
        "materials": "embedded",
        "retrieved_at": null,
        "tree_digest": "sha256:ca271a8c76e0c0b1f22299444827678cb60bc0f9a5f69d11b121ba4c64f757d1",
        "url": null
      },
      "started_at": "2026-10-02T21:15:54Z"
    },
    "provides": {
      "citation_stable": false,
      "features": [
        "grep",
        "count"
      ],
      "fidelity": {
        "complete": true,
        "verbatim": false
      },
      "format": "cart/1",
      "license_key_required": false,
      "max_shard_bytes": 18672811,
      "profiles": [],
      "reader": ">=0.8",
      "roles": {
        "text": [
          "text"
        ]
      }
    },
    "shape": {
      "bytes": {
        "cart": 1866396543,
        "ratio": 2.68,
        "source": 4999921197
      },
      "columns": [
        {
          "cardinality": null,
          "examples": [],
          "indexes": [
            "text"
          ],
          "name": "text",
          "stored": false,
          "type": "string"
        },
        {
          "cardinality": null,
          "examples": [],
          "indexes": [],
          "name": "id",
          "stored": true,
          "type": "integer"
        },
        {
          "cardinality": null,
          "examples": [],
          "indexes": [],
          "name": "url",
          "stored": true,
          "type": "string"
        },
        {
          "cardinality": null,
          "examples": [],
          "indexes": [],
          "name": "title",
          "stored": true,
          "type": "string"
        },
        {
          "cardinality": null,
          "examples": [],
          "indexes": [],
          "name": "lang",
          "stored": true,
          "type": "string"
        }
      ],
      "count": {
        "files": null,
        "rows": 1520141
      },
      "input": {
        "format": "csv",
        "has_header": true,
        "log_format": null,
        "log_pattern": null
      },
      "kind": "records",
      "languages": [],
      "segment": "row"
    }
  },
  "published_at": "2026-10-04T00:55:54Z"
}
